{
  "$schema": "http://json-schema.org/draft-07/schema#",
  "type": "array",
  "items": {
    "type": "object",
    "required": ["name", "slug", "parent", "descriptionHTML", "sortOrder"],
    "properties": {
      "name": {"type": "string"},
      "slug": {"type": "string", "pattern": "^[a-z0-9-]+$"},
      "parent": {"type": ["string", "null"]},
      "descriptionHTML": {"type": "string"},
      "sortOrder": {"type": "integer"}
    },
    "additionalProperties": false
  }
}
